<?xml version="1.0" encoding="UTF-8"?>
<?xml-stylesheet href="Employees.xsl" type="text/xsl"?>
<!--
To change this license header, choose License Headers in Project Properties.
To change this template file, choose Tools | Templates
and open the template in the editor.
-->


<Company xmlns:xsi="http://www.w3.org/2001/XMLSchema-instance"
xsi:noNamespaceSchemaLocation="EmployeeInfoXmlSchema.xsd">
    <Employee>
        <EId>111</EId>
        <name>Drew Barrymore</name>
        <age>60</age>
        <salary>200000</salary>
        <emailid>allFriends23@gmail.com</emailid>
        <phoneno>557525125</phoneno>
        <designation>Associate Project Manager</designation>
    </Employee>
    
    <Employee>
        <EId>112</EId>
        <name>Derry Jackson</name>
        <age>59</age>
        <salary>100000</salary>
        <emailid>merryDerry911@gmail.com</emailid>
        <phoneno>94889542</phoneno>
        <designation>Associate Project Manager</designation>
    </Employee>

    <Employee>
        <EId>113</EId>
        <name>Ravi Shastri</name>
        <age>51</age>
        <salary>70000</salary>
        <emailid>ravishastri67@gmail.com</emailid>
        <phoneno>98745612</phoneno>
        <designation>Associate Project Manager</designation>
    </Employee>
    <Employee>
        <EId>114</EId>
        <name>Anubha Jauhari</name>
        <age>49</age>
        <salary>52000</salary>
        <emailid>anubhaJ7@gmail.com</emailid>
        <phoneno>98752621</phoneno>
        <designation>Team Leader</designation>
    </Employee>
    <Employee>
        <EId>115</EId>
        <name>Ratul Khalnayak</name>
        <age>31</age>
        <salary>50000</salary>
        <emailid>ratulKH123@gmail.com</emailid>
        <phoneno>98789855</phoneno>
        <designation>Developer</designation>
    </Employee>
    
</Company>
